{
  "schema_version": 1,
  "id": "dev.cardputerzero.hello",
  "name": "Hello Card",
  "version": "0.1.0",
  "sdk_version": "0.1",
  "runtime": "wamr",
  "entrypoint": "bin/hello-card.wasm",
  "display": "standard",
  "resources": {
    "memory_mb": 24,
    "storage_mb": 8
  },
  "permissions": [
    {
      "name": "notifications.post",
      "reason": "Show the result of the Hello Card action"
    },
    {
      "name": "network.client",
      "reason": "Run the user-requested HTTPS connectivity check"
    },
    {
      "name": "documents.open",
      "reason": "Open a document selected in the trusted system picker"
    },
    {
      "name": "audio.playback",
      "reason": "Play the user-requested audio test tone"
    },
    {
      "name": "audio.capture",
      "reason": "Capture a short microphone sample when requested"
    },
    {
      "name": "camera.capture",
      "reason": "Capture a frame after the user presses the camera key"
    },
    {
      "name": "hardware.gpio",
      "reason": "Toggle the logical Grove function output after the user presses G"
    },
    {
      "name": "radio.lora",
      "reason": "Receive a bounded LoRa packet after the user presses L"
    }
  ]
}
